{
  "$schema": "http://json-schema.org/draft-07/schema#",
  "title": "module_output_v1",
  "type": "object",
  "required": [
    "module_id", "module_name", "module_version", "schema_version",
    "request_id", "analysis_date", "status", "signal", "score",
    "confidence", "reasons", "risks", "summary"
  ],
  "properties": {
    "module_id": {"type": "string", "minLength": 1},
    "module_name": {"type": "string", "minLength": 1},
    "module_version": {"type": "string", "pattern": "^\\d+\\.\\d+\\.\\d+$"},
    "schema_version": {"type": "string", "const": "module_output_v1"},
    "request_id": {"type": "string", "minLength": 1},
    "analysis_date": {"type": "string", "pattern": "^\\d{4}-\\d{2}-\\d{2}$"},
    "status": {"enum": ["success", "partial", "failed"]},
    "signal": {"oneOf": [{"enum": ["看多", "中性", "看空"]}, {"type": "null"}]},
    "score": {"oneOf": [{"type": "integer", "minimum": -100, "maximum": 100}, {"type": "null"}]},
    "confidence": {"oneOf": [{"type": "number", "minimum": 0, "maximum": 1}, {"type": "null"}]},
    "reasons": {
      "type": "array",
      "maxItems": 5,
      "items": {"type": "string", "maxLength": 80}
    },
    "risks": {
      "type": "array",
      "maxItems": 5,
      "items": {"type": "string", "maxLength": 80}
    },
    "summary": {"type": "string", "maxLength": 50},
    "error": {
      "type": "object",
      "required": ["code", "message"],
      "properties": {
        "code": {
          "enum": [
            "DATA_NOT_FOUND", "DATA_PARTIAL", "DATA_SOURCE_TIMEOUT",
            "DATA_SOURCE_RATE_LIMIT", "REASONING_FAILED",
            "INVALID_INPUT", "INTERNAL_ERROR"
          ]
        },
        "message": {"type": "string"},
        "retriable": {"type": "boolean"},
        "missing_fields": {"type": "array", "items": {"type": "string"}}
      }
    },
    "metrics": {
      "type": "object",
      "properties": {
        "latency_ms": {"type": "number"},
        "data_sources_used": {"type": "array", "items": {"type": "string"}}
      }
    },
    "module_specific": {"type": "object"}
  }
}
