{
  "module_id": "industry_analysis",
  "module_name": "行业分析模块",
  "module_version": "1.0.0",
  "schema_version": "module_output_v1",
  "request_id": "req_20260430_smoke_002",
  "analysis_date": "2026-04-30",
  "status": "partial",
  "signal": "中性",
  "score": -23,
  "confidence": 0.53,
  "reasons": [
    "白酒Ⅱ行业12M跌-19.1%,同期沪深300涨+27.4%,RS仅0.635,趋势持续下行",
    "行业1M涨跌比3:16(0.1875),涨停0家,行业内分化严重偏空",
    "茅台是行业市值绝对龙头(排名第1),领先第二名五粮液4.6倍",
    "茅台3M涨+3.1%,龙头平均3M跌-6.5%,RS_3m=1.10,中期相对强于同行",
    "基本面/资金/宏观政策维度 v2 补全,当前不计入评分"
  ],
  "risks": [
    "行业整体趋势仍下行,龙头地位无法完全对冲行业系统性风险",
    "茅台1M跌幅-5.1%略低于龙头均值,短期动能偏弱",
    "白酒行业估值修复依赖宏观消费复苏,不确定性较高",
    "基本面/资金面信号暂缺,综合判断存在盲区"
  ],
  "summary": "白酒趋势下行但茅台是绝对龙头,综合中性偏弱。",
  "metrics": {
    "latency_ms": 45000,
    "data_sources_used": ["tushare"]
  },
  "module_specific": {
    "classification": {
      "primary_industry": {
        "system": "申万二级",
        "code": "801125.SI",
        "name": "白酒Ⅱ"
      },
      "l1_industry": {
        "code": "801120.SI",
        "name": "食品饮料"
      },
      "related_concepts": [
        {"name": "转融券标的", "code": "TS108"},
        {"name": "超级品牌", "code": "TS118"},
        {"name": "贵州国资改革", "code": "TS125"}
      ]
    },
    "agent_breakdown": {
      "trend": {
        "score": -55,
        "confidence": 0.75,
        "stage": "下行",
        "key_signals": [
          {"name": "industry_return_1m", "value": -0.0479, "interpretation": "1M跌-4.8%"},
          {"name": "industry_return_3m", "value": -0.0185, "interpretation": "3M跌-1.9%"},
          {"name": "industry_return_6m", "value": -0.1209, "interpretation": "6M跌-12.1%"},
          {"name": "industry_return_12m", "value": -0.1907, "interpretation": "12M跌-19.1%"},
          {"name": "rs_vs_csi300_1m", "value": 0.8964, "interpretation": "显著跑输市场"},
          {"name": "rs_vs_csi300_12m", "value": 0.6351, "interpretation": "严重跑输市场"},
          {"name": "advance_decline_ratio", "value": 0.1875, "interpretation": "3涨16跌,极度偏空"}
        ]
      },
      "leaders": {
        "score": 10,
        "confidence": 0.65,
        "target_position": "绝对龙头",
        "rank_in_industry": 1,
        "rs_vs_leaders_avg_1m": 0.9941,
        "rs_vs_leaders_avg_3m": 1.1021,
        "leaders_avg_1m": -0.0455,
        "leaders_avg_3m": -0.0645,
        "key_signals": [
          {"name": "rank_in_industry", "value": 1, "interpretation": "绝对龙头,+2"},
          {"name": "mv_ratio_vs_no2", "value": 4.6, "interpretation": "市值领先4.6倍"},
          {"name": "leaders_avg_1m", "value": -0.0455, "interpretation": "龙头集体下跌,-1"},
          {"name": "rs_vs_leaders_1m", "value": 0.9941, "interpretation": "1M微弱于平均,0"},
          {"name": "rs_vs_leaders_3m", "value": 1.1021, "interpretation": "3M强于龙头均值,+1"}
        ],
        "top5_leaders": [
          {"ticker": "600519.SH", "name": "贵州茅台", "total_mv": 173413127.1, "return_1m": -0.0511, "return_3m": 0.0311, "pe_ttm": 20.97},
          {"ticker": "000858.SZ", "name": "五粮液", "total_mv": 37682650.5, "return_1m": -0.0700, "return_3m": -0.0390, "pe_ttm": 13.25},
          {"ticker": "600809.SH", "name": "山西汾酒", "total_mv": 17488187.1, "return_1m": -0.0071, "return_3m": -0.1111, "pe_ttm": 15.93},
          {"ticker": "000568.SZ", "name": "泸州老窖", "total_mv": 14734139.0, "return_1m": -0.0580, "return_3m": -0.1091, "pe_ttm": 14.81},
          {"ticker": "002304.SZ", "name": "洋河股份", "total_mv": 7416229.1, "return_1m": -0.0413, "return_3m": -0.0942, "pe_ttm": 73.03}
        ]
      },
      "fundamentals": {
        "score": 0,
        "confidence": 0.3,
        "note": "v2 will add"
      },
      "capital_flow": {
        "score": 0,
        "confidence": 0.3,
        "note": "v2 will add"
      },
      "macro_policy": {
        "score": 0,
        "confidence": 0.3,
        "note": "v2 will add"
      }
    },
    "stock_in_industry": {
      "relative_position": "绝对龙头",
      "industry_boost": 0,
      "rationale": "行业趋势弱(-55)与龙头地位部分对冲(+10),综合中性偏弱(-23)"
    },
    "weights_used": {
      "trend": 0.5,
      "leaders": 0.5,
      "_note": "trend + leaders 均权;3 个 stub agent 不参与加权"
    }
  }
}
